file_name,subreddit_name,post_name,date_posted,has_audio,is_video,source_url,file_url
jnsecfe77ix41.jpg,aww,This is not our cat. He does not respect boundaries. He comes round here all the time. He's a legend,2020-05-08 18:42:10+10:00,False,False,https://i.redd.it/jnsecfe77ix41.jpg,https://i.redd.it/jnsecfe77ix41.jpg
r31d9v0keix41.mp4,aww,Let's play,2020-05-08 19:23:22+10:00,True,True,https://v.redd.it/r31d9v0keix41,https://vreddit.cc/r31d9v0keix41.mp4
xxd4obvbxhx41.mp4,aww,Warm and cozy,2020-05-08 17:47:06+10:00,False,True,https://v.redd.it/xxd4obvbxhx41,https://vreddit.cc/xxd4obvbxhx41.mp4
BitesizedIckyDevilfish.mp4,aww,A gentle giant discovers his bed has been occupied,2020-05-08 11:35:22+10:00,False,True,https://gfycat.com/bitesizedickydevilfish,https://giant.gfycat.com/BitesizedIckyDevilfish.mp4
z7vq71vq8hx41.jpg,aww,Now thats cute,2020-05-08 15:28:58+10:00,False,False,https://i.redd.it/z7vq71vq8hx41.jpg,https://i.redd.it/z7vq71vq8hx41.jpg
pc7x6jp2tex41.jpg,relationshipmemes,Me when I started dating my SO,2020-05-08 10:13:11+10:00,False,False,https://i.redd.it/pc7x6jp2tex41.jpg,https://i.redd.it/pc7x6jp2tex41.jpg
ahd2ysb67hx41.jpg,relationshipmemes,First date 21 questions game. I'm not very good,2020-05-08 15:20:09+10:00,False,False,https://i.redd.it/ahd2ysb67hx41.jpg,https://i.redd.it/ahd2ysb67hx41.jpg
b59be24wbcx41.gif,relationshipmemes,He do be looking fine though,2020-05-07 22:57:45+10:00,False,False,https://i.redd.it/b59be24wbcx41.gif,https://i.redd.it/b59be24wbcx41.gif
qsxxk9a2uex41.jpg,relationshipmemes,Cookie And Cream: SUPER Mad,2020-05-08 07:23:26+10:00,False,False,https://i.redd.it/qsxxk9a2uex41.jpg,https://i.redd.it/qsxxk9a2uex41.jpg
lhuuwpo4mdx41.png,relationshipmemes,Me: Are you drunk? Him: Pshhhh... I might be tipsy. (My first meme! ),2020-05-08 03:16:51+10:00,False,False,https://i.redd.it/lhuuwpo4mdx41.png,https://i.redd.it/lhuuwpo4mdx41.png
yMsFNeK.jpg,earthporn,"First day in the nature after the lock down, Italy [OC] [4032x3024]",2020-05-08 08:01:44+10:00,False,False,https://i.imgur.com/yMsFNeK.jpg,https://i.imgur.com/yMsFNeK.jpg
2KC4chJ.jpg,earthporn,"Eroded rocks and beautiful blue water of Corfu, Greece [OC] [1242x1656]",2020-05-08 21:05:02+10:00,False,False,https://i.imgur.com/2KC4chJ.jpg,https://i.imgur.com/2KC4chJ.jpg
lysxdxxs0hx41.png,earthporn,"Del Mar, California Sunset. [1877 x 2226] [OC]",2020-05-08 14:44:36+10:00,False,False,https://i.redd.it/lysxdxxs0hx41.png,https://i.redd.it/lysxdxxs0hx41.png
c3p7aw3kudx41.jpg,earthporn,Oregon's moss covered rain forest [OC][4826x6031][OC],2020-05-08 04:04:16+10:00,False,False,https://i.redd.it/c3p7aw3kudx41.jpg,https://i.redd.it/c3p7aw3kudx41.jpg
sc95kam08jx41.jpg,earthporn,"Sunrise from the Monastery in Tengboche, Nepal [OC] [3022x3778] IG:@zachgibbonsphotography",2020-05-08 22:08:26+10:00,False,False,https://i.redd.it/sc95kam08jx41.jpg,https://i.redd.it/sc95kam08jx41.jpg
4iqd2uC.mp4,aww,A baby has its first contact with a potential surrogate mother,2020-05-09 07:11:10+10:00,False,True,https://i.imgur.com/4iqd2uC.gifv,https://i.imgur.com/4iqd2uC.mp4
m4eq3l6jvmx41.mp4,aww,Photographer had a photo shoot with an adorable client,2020-05-09 10:26:40+10:00,True,True,https://v.redd.it/m4eq3l6jvmx41,https://vreddit.cc/m4eq3l6jvmx41.mp4
SameOddballButterfly.mp4,aww,The proud mother cat presenting her kittens to her human as a sign of trust,2020-05-09 11:03:18+10:00,False,True,https://gfycat.com/sameoddballbutterfly,https://giant.gfycat.com/SameOddballButterfly.mp4
ee0m7yL.jpg,aww,We found out the dog we adopted last year had taken part in a professional photoshoot to try to get her adopted. It was a maternity photoshoot.,2020-05-09 08:04:24+10:00,False,False,https://imgur.com/ee0m7yL,https://i.imgur.com/ee0m7yL.jpg
xg0xl3ogvkx41.jpg,relationshipmemes,Must not smile,2020-05-09 03:41:37+10:00,False,False,https://i.redd.it/xg0xl3ogvkx41.jpg,https://i.redd.it/xg0xl3ogvkx41.jpg
fwfnb6wbukx41.jpg,relationshipmemes,Statue of Liberty,2020-05-09 03:35:17+10:00,False,False,https://i.redd.it/fwfnb6wbukx41.jpg,https://i.redd.it/fwfnb6wbukx41.jpg
1ehill06uov41.jpg,relationshipmemes,How To Build Trust In A Relationship,2020-05-08 23:21:36+10:00,False,False,https://i.redd.it/1ehill06uov41.jpg,https://i.redd.it/1ehill06uov41.jpg
w6humtqyllx41.jpg,earthporn,"White cliffs and blue sky of Seven Sisters, England. [OC] (1080x2240)",2020-05-09 06:10:12+10:00,False,False,https://i.redd.it/w6humtqyllx41.jpg,https://i.redd.it/w6humtqyllx41.jpg
2my4t3b3dlx41.jpg,earthporn,OC - Foggy Morning in the Oregon Rainforests (1827x2737),2020-05-09 05:21:49+10:00,False,False,https://i.redd.it/2my4t3b3dlx41.jpg,https://i.redd.it/2my4t3b3dlx41.jpg
thlbhhv2plx41.jpg,earthporn,Foggy lakeside in the Canadian Rockies. [1080x1350] [OC],2020-05-09 06:29:01+10:00,False,False,https://i.redd.it/thlbhhv2plx41.jpg,https://i.redd.it/thlbhhv2plx41.jpg
x1tm3ydw1lx41.jpg,earthporn,"[OC] Mountain at Morraine Lake in Banff, Alberta. [1600x1067]",2020-05-09 04:19:45+10:00,False,False,https://i.redd.it/x1tm3ydw1lx41.jpg,https://i.redd.it/x1tm3ydw1lx41.jpg
ch0sdmn9smx41.jpg,aww,The way Nova fell asleep in her dad’s lap is priceless.,2020-05-09 10:07:17+10:00,False,False,https://i.redd.it/ch0sdmn9smx41.jpg,https://i.redd.it/ch0sdmn9smx41.jpg
vconqxwoblx41.jpg,relationshipmemes,”cuddles included”,2020-05-09 05:12:37+10:00,False,False,https://i.redd.it/vconqxwoblx41.jpg,https://i.redd.it/vconqxwoblx41.jpg
y2tll312pmx41.jpg,aww,He made me a present at doggy daycare. He's so proud.,2020-05-09 09:49:18+10:00,False,False,https://i.redd.it/y2tll312pmx41.jpg,https://i.redd.it/y2tll312pmx41.jpg
h8wb9so37ox41.jpg,relationshipmemes,Spooning is in short supply,2020-05-09 14:52:12+10:00,False,False,https://i.redd.it/h8wb9so37ox41.jpg,https://i.redd.it/h8wb9so37ox41.jpg
izw0ti4i5nx41.jpg,earthporn,"The Pacific Northwest is a special place. Mount Hood, OR [OC] [4032x3024]",2020-05-09 11:21:50+10:00,False,False,https://i.redd.it/izw0ti4i5nx41.jpg,https://i.redd.it/izw0ti4i5nx41.jpg
p3gus6kzka041.mp4,aww,Color blind student gets to see color for the first time.,2020-05-10 04:47:00+10:00,True,True,https://v.redd.it/p3gus6kzka041,https://vreddit.cc/p3gus6kzka041.mp4
fcudp68qkrx41.jpg,aww,We’ve been together for 10 years now. He is the best thing to ever happen to me!,2020-05-10 02:13:58+10:00,False,False,https://i.redd.it/fcudp68qkrx41.jpg,https://i.redd.it/fcudp68qkrx41.jpg
0c42fpk90rx41.mp4,aww,Hunter mode - ON,2020-05-10 00:19:29+10:00,False,True,https://v.redd.it/0c42fpk90rx41,https://vreddit.cc/0c42fpk90rx41.mp4
4ks0wscl9qx41.jpg,relationshipmemes,Literally every day,2020-05-09 21:49:44+10:00,False,False,https://i.redd.it/4ks0wscl9qx41.jpg,https://i.redd.it/4ks0wscl9qx41.jpg
r2iz2huy0sx41.jpg,relationshipmemes,Spooky skeleton time,2020-05-10 03:44:57+10:00,False,False,https://i.redd.it/r2iz2huy0sx41.jpg,https://i.redd.it/r2iz2huy0sx41.jpg
iw4gs2usjox41.jpg,relationshipmemes,Actually the case rn,2020-05-09 16:03:23+10:00,False,False,https://i.redd.it/iw4gs2usjox41.jpg,https://i.redd.it/iw4gs2usjox41.jpg
352ii2dioqx41.png,relationshipmemes,"I got love, I got sex, wha'chu want?",2020-05-09 23:13:23+10:00,False,False,https://i.redd.it/352ii2dioqx41.png,https://i.redd.it/352ii2dioqx41.png
cx9bc2mc8qx41.jpg,earthporn,Found a patch of wild garlic in a local forest (The Netherlands) [OC][1638x2048],2020-05-09 21:42:49+10:00,False,False,https://i.redd.it/cx9bc2mc8qx41.jpg,https://i.redd.it/cx9bc2mc8qx41.jpg
ghx6iotogox41.jpg,earthporn,"Lake McDonald, Montana [OC][2048 x 1365]",2020-05-09 15:46:22+10:00,False,False,https://i.redd.it/ghx6iotogox41.jpg,https://i.redd.it/ghx6iotogox41.jpg
vmjE5eY.jpg,earthporn,"Coron Island, Philippines [OC] [1242x1656]",2020-05-09 21:56:46+10:00,False,False,https://i.imgur.com/vmjE5eY.jpg,https://i.imgur.com/vmjE5eY.jpg
4il1rnc1nsx41.jpg,earthporn,"Golden Larches, Seeley Lake, Montana [OC][900x1350]",2020-05-10 05:49:05+10:00,False,False,https://i.redd.it/4il1rnc1nsx41.jpg,https://i.redd.it/4il1rnc1nsx41.jpg
r0x65e3m2tx41.jpg,earthporn,"Uraman Takht, Kurdistan, Iran. [OC] [1080*861]",2020-05-10 07:15:58+10:00,False,False,https://i.redd.it/r0x65e3m2tx41.jpg,https://i.redd.it/r0x65e3m2tx41.jpg
rcpr2brqltx41.jpg,aww,"After 8 years waiting, I picked up this little girl yesterday",2020-05-10 09:03:12+10:00,False,False,https://i.redd.it/rcpr2brqltx41.jpg,https://i.redd.it/rcpr2brqltx41.jpg
HeftyPaltryBlackbuck.mp4,aww,Puppy loves water,2020-05-10 07:00:52+10:00,False,True,https://gfycat.com/heftypaltryblackbuck,https://giant.gfycat.com/HeftyPaltryBlackbuck.mp4
ny16v5w38rx41.mp4,aww,This makes me happy :),2020-05-10 07:23:31+10:00,True,True,https://v.redd.it/ny16v5w38rx41,https://vreddit.cc/ny16v5w38rx41.mp4
ahqhx6qzcsx41.mp4,aww,Fun fact about Carter: he watches cookies bake in the oven from start to finish.,2020-05-10 04:52:39+10:00,True,True,https://v.redd.it/ahqhx6qzcsx41,https://vreddit.cc/ahqhx6qzcsx41.mp4
8x77p528mtx41.jpg,earthporn,"Moonset/Sunrise below the Polar Circle in Antarctica [OC], [5568 x 3712]",2020-05-10 09:05:57+10:00,False,False,https://i.redd.it/8x77p528mtx41.jpg,https://i.redd.it/8x77p528mtx41.jpg
dri1z2z6ptx41.jpg,earthporn,"Upstate New York, today, [OC] [3024x4032]",2020-05-10 09:22:33+10:00,False,False,https://i.redd.it/dri1z2z6ptx41.jpg,https://i.redd.it/dri1z2z6ptx41.jpg
nx1i5gvx1zx41.mp4,aww,My daughter playing Pokémon the first time and catching her first Pokémon,2020-05-11 03:23:43+10:00,True,True,https://v.redd.it/nx1i5gvx1zx41,https://vreddit.cc/nx1i5gvx1zx41.mp4
sDIbawB.gif,aww,Theodore the hamster climbing up stairs,2020-05-11 02:35:18+10:00,False,False,https://i.imgur.com/sDIbawB.gif,https://i.imgur.com/sDIbawB.gif
473etrrumc841.gif,aww,Happy Mother’s Day ❤️,2020-05-11 04:35:24+10:00,False,False,https://i.redd.it/473etrrumc841.gif,https://i.redd.it/473etrrumc841.gif
pephv0eznyx41.mp4,aww,The prettiest boy I ever did see.,2020-05-11 02:06:24+10:00,True,True,https://v.redd.it/pephv0eznyx41,https://vreddit.cc/pephv0eznyx41.mp4
sv68k56rdyx41.mp4,aww,There’s a good boy outside my window,2020-05-11 01:07:37+10:00,True,True,https://v.redd.it/sv68k56rdyx41,https://vreddit.cc/sv68k56rdyx41.mp4
xb5tigq9iwx41.jpg,relationshipmemes,Stop worrying,2020-05-10 18:49:04+10:00,False,False,https://i.redd.it/xb5tigq9iwx41.jpg,https://i.redd.it/xb5tigq9iwx41.jpg
psbsdw5n3yx41.jpg,relationshipmemes,Husband material,2020-05-11 00:10:38+10:00,False,False,https://i.redd.it/psbsdw5n3yx41.jpg,https://i.redd.it/psbsdw5n3yx41.jpg
x5kk7mp6bzx41.jpg,relationshipmemes,Sunset Thoughts,2020-05-11 04:14:42+10:00,False,False,https://i.redd.it/x5kk7mp6bzx41.jpg,https://i.redd.it/x5kk7mp6bzx41.jpg
q01qie9khyx41.jpg,relationshipmemes,"this always happens to me, help",2020-05-11 01:29:02+10:00,False,False,https://i.redd.it/q01qie9khyx41.jpg,https://i.redd.it/q01qie9khyx41.jpg
t8h4i3tro0y41.jpg,relationshipmemes,"While my boyfriend is definitely more of a gamer than I am, it’s nice that he takes the time to help me learn :) <3",2020-05-11 08:52:38+10:00,False,False,https://i.redd.it/t8h4i3tro0y41.jpg,https://i.redd.it/t8h4i3tro0y41.jpg
u5t6lgifqxx41.jpg,earthporn,"Mist in the early morning, the Netherlands [5053 x 3369] [OC]",2020-05-10 23:01:02+10:00,False,False,https://i.redd.it/u5t6lgifqxx41.jpg,https://i.redd.it/u5t6lgifqxx41.jpg
zllxn4v9iwx41.jpg,earthporn,"Storm born. Fiordland, New Zealand {OC} (1500x1000) @williampatino_photography",2020-05-10 18:49:05+10:00,False,False,https://i.redd.it/zllxn4v9iwx41.jpg,https://i.redd.it/zllxn4v9iwx41.jpg
517trplolyx41.jpg,earthporn,Bryce Canyon National Park after a snow storm! [OC] [2048x2048],2020-05-11 01:51:48+10:00,False,False,https://i.redd.it/517trplolyx41.jpg,https://i.redd.it/517trplolyx41.jpg
bb8wr2ehzyx41.jpg,earthporn,Hobbit Hills in Switzerland [OC][6016 × 4016],2020-05-11 03:09:32+10:00,False,False,https://i.redd.it/bb8wr2ehzyx41.jpg,https://i.redd.it/bb8wr2ehzyx41.jpg
v9u11n5xs6y41.jpg,aww,"My kitten has taken a liking almost exclusively to me since I’m home with him all day. Well today when he ~finally~ hopped in my boyfriends lap, I snapped this gem.",2020-05-12 05:26:34+10:00,False,False,https://i.redd.it/v9u11n5xs6y41.jpg,https://i.redd.it/v9u11n5xs6y41.jpg
AgileGrandAmphiuma.mp4,aww,Watering the best of plants,2020-05-12 03:46:19+10:00,False,True,https://gfycat.com/agilegrandamphiuma,https://giant.gfycat.com/AgileGrandAmphiuma.mp4
dciyaiaet6y41.mp4,aww,"Have wanted a dog all my life, now I’m 30 it’s finally happened and our first meeting was all a bit much!",2020-05-12 05:29:24+10:00,True,True,https://v.redd.it/dciyaiaet6y41,https://vreddit.cc/dciyaiaet6y41.mp4
rmbtawvyb5y41.jpg,aww,"Blaze, the vitiligo labrador",2020-05-12 00:30:11+10:00,False,False,https://i.redd.it/rmbtawvyb5y41.jpg,https://i.redd.it/rmbtawvyb5y41.jpg
HAplYtd.jpg,aww,Every day this nice old man I've never met stops his truck for 10 seconds so his dog can say hi to my dog.,2020-05-12 04:42:12+10:00,False,False,https://imgur.com/HAplYtd,https://i.imgur.com/HAplYtd.jpg
a368lysxe5y41.jpg,relationshipmemes,You know I'm goin'st to talk about her,2020-05-12 00:46:26+10:00,False,False,https://i.redd.it/a368lysxe5y41.jpg,https://i.redd.it/a368lysxe5y41.jpg
4jdd408tm3y41.jpg,relationshipmemes,Bro just had to get this off my chest,2020-05-11 18:46:59+10:00,False,False,https://i.redd.it/4jdd408tm3y41.jpg,https://i.redd.it/4jdd408tm3y41.jpg
oz9mxuxfb5y41.jpg,relationshipmemes,"Yup, this sounds about right.",2020-05-12 00:26:49+10:00,False,False,https://i.redd.it/oz9mxuxfb5y41.jpg,https://i.redd.it/oz9mxuxfb5y41.jpg
ug4rb22m95y41.jpg,relationshipmemes,Me whenever I try to shoot my shot 🙃,2020-05-12 00:16:34+10:00,False,False,https://i.redd.it/ug4rb22m95y41.jpg,https://i.redd.it/ug4rb22m95y41.jpg
pewne8nod6y41.jpg,relationshipmemes,When your SO is missing at 3 am,2020-05-12 04:01:11+10:00,False,False,https://i.redd.it/pewne8nod6y41.jpg,https://i.redd.it/pewne8nod6y41.jpg
ajrmenbcb5y41.jpg,earthporn,[OC] The endless Beauty of Iceland and it's Canyons - A place I can't wait to return to in the hopefully close future [800x1200],2020-05-12 00:27:46+10:00,False,False,https://i.redd.it/ajrmenbcb5y41.jpg,https://i.redd.it/ajrmenbcb5y41.jpg
abhyp0wfk4y41.jpg,earthporn,"Phi Phi Islands, Thailand [OC] [4608x3456]",2020-05-11 21:55:37+10:00,False,False,https://i.redd.it/abhyp0wfk4y41.jpg,https://i.redd.it/abhyp0wfk4y41.jpg
amo7y8p056y41.jpg,earthporn,"Sunshine peaking through in Chiba, Japan [OC] (750x922)",2020-05-12 03:12:37+10:00,False,False,https://i.redd.it/amo7y8p056y41.jpg,https://i.redd.it/amo7y8p056y41.jpg
opdunuje06y41.jpg,earthporn,"Crater Lake, Oregon [OC][1280x1920]",2020-05-12 02:46:45+10:00,False,False,https://i.redd.it/opdunuje06y41.jpg,https://i.redd.it/opdunuje06y41.jpg
cjvg293rw3y41.jpg,earthporn,"Noojee waterfall, Australia [OC] 1080x1350]",2020-05-11 19:43:31+10:00,False,False,https://i.redd.it/cjvg293rw3y41.jpg,https://i.redd.it/cjvg293rw3y41.jpg
v1xmjzzxzdy41.jpg,aww,My mum sent me this photo today on her way to the grocery store!,2020-05-13 05:38:25+10:00,False,False,https://i.redd.it/v1xmjzzxzdy41.jpg,https://i.redd.it/v1xmjzzxzdy41.jpg
jnj0xyd5acy41.jpg,aww,He’s so proud of his artwork,2020-05-12 23:52:04+10:00,False,False,https://i.redd.it/jnj0xyd5acy41.jpg,https://i.redd.it/jnj0xyd5acy41.jpg
p295r6ij9ey41.mp4,aww,Pure violence,2020-05-13 06:32:25+10:00,True,True,https://v.redd.it/p295r6ij9ey41,https://vreddit.cc/p295r6ij9ey41.mp4
veva0ovw6cy41.jpg,aww,sweet meow face.,2020-05-12 23:35:08+10:00,False,False,https://i.redd.it/veva0ovw6cy41.jpg,https://i.redd.it/veva0ovw6cy41.jpg
7yfxfkk9uby41.jpg,aww,When you come late at home,2020-05-12 22:23:06+10:00,False,False,https://i.redd.it/7yfxfkk9uby41.jpg,https://i.redd.it/7yfxfkk9uby41.jpg
67prt2k4bby41.jpg,relationshipmemes,At least once a day,2020-05-12 20:35:44+10:00,False,False,https://i.redd.it/67prt2k4bby41.jpg,https://i.redd.it/67prt2k4bby41.jpg
qpXxYgz.mp4,relationshipmemes,“Go on”,2020-05-13 05:47:29+10:00,False,True,https://i.imgur.com/qpXxYgz.gifv,https://i.imgur.com/qpXxYgz.mp4
lznbaoqv6dy41.jpg,relationshipmemes,quarantine got us all like,2020-05-13 02:55:30+10:00,False,False,https://i.redd.it/lznbaoqv6dy41.jpg,https://i.redd.it/lznbaoqv6dy41.jpg
mprarxyb7cy41.jpg,relationshipmemes,I hate it when my babe has to go,2020-05-12 23:36:17+10:00,False,False,https://i.redd.it/mprarxyb7cy41.jpg,https://i.redd.it/mprarxyb7cy41.jpg
lolv0dx4ldy41.png,relationshipmemes,Everytime there's an issue,2020-05-13 04:15:26+10:00,False,False,https://i.redd.it/lolv0dx4ldy41.png,https://i.redd.it/lolv0dx4ldy41.png
8n5pc9hmscy41.jpg,earthporn,Highlands of Iceland [OC][1080x1350],2020-05-13 01:36:05+10:00,False,False,https://i.redd.it/8n5pc9hmscy41.jpg,https://i.redd.it/8n5pc9hmscy41.jpg
yr1b53ihjdy41.jpg,earthporn,Blue hour long exposure in the Canadian Rockies. [1080x1350] [OC],2020-05-13 04:07:09+10:00,False,False,https://i.redd.it/yr1b53ihjdy41.jpg,https://i.redd.it/yr1b53ihjdy41.jpg
l97xz3zniby41.jpg,earthporn,Beautiful autumnal colours along the River Dranse in the Haute Savoie [OC] [3566 × 4616],2020-05-12 21:19:38+10:00,False,False,https://i.redd.it/l97xz3zniby41.jpg,https://i.redd.it/l97xz3zniby41.jpg
jias12bcvay41.jpg,earthporn,"South Island, New Zealand [OC] [1080x1350]",2020-05-12 19:07:17+10:00,False,False,https://i.redd.it/jias12bcvay41.jpg,https://i.redd.it/jias12bcvay41.jpg
ocmnqr0f4dy41.jpg,earthporn,"Sourdough Mountain, North Cascades WA [OC][3024x4028]",2020-05-13 02:41:45+10:00,False,False,https://i.redd.it/ocmnqr0f4dy41.jpg,https://i.redd.it/ocmnqr0f4dy41.jpg
2450e8c5pfy41.mp4,aww,10 year old Winston arrived yesterday and has quickly made himself at home!,2020-05-13 11:23:11+10:00,True,True,https://v.redd.it/2450e8c5pfy41,https://vreddit.cc/2450e8c5pfy41.mp4
bccbcz2u4fy41.jpg,aww,Shmiglet finds a warm patch of sunshine,2020-05-13 09:27:36+10:00,False,False,https://i.redd.it/bccbcz2u4fy41.jpg,https://i.redd.it/bccbcz2u4fy41.jpg
k3al5hu4bfy41.jpg,aww,My brother’s German Shepherd. Ozzy turned 1 today and I think he is beautiful.,2020-05-13 10:02:55+10:00,False,False,https://i.redd.it/k3al5hu4bfy41.jpg,https://i.redd.it/k3al5hu4bfy41.jpg
p7fl2p0r5fy41.jpg,relationshipmemes,Anyone else?,2020-05-13 09:32:45+10:00,False,False,https://i.redd.it/p7fl2p0r5fy41.jpg,https://i.redd.it/p7fl2p0r5fy41.jpg
11prnz679ey41.jpg,relationshipmemes,A meme for y'all since I'm not gonna stir shit by sending it to my man.,2020-05-13 06:30:20+10:00,False,False,https://i.redd.it/11prnz679ey41.jpg,https://i.redd.it/11prnz679ey41.jpg
hazb1acoiey41.jpg,earthporn,"Jurassic Garden of Eden, Mount Anne, Australia [OC] [1345x931]",2020-05-13 07:31:30+10:00,False,False,https://i.redd.it/hazb1acoiey41.jpg,https://i.redd.it/hazb1acoiey41.jpg
5gg20u7mjfy41.jpg,aww,When you cut your own bangs in quarantine,2020-05-13 10:50:27+10:00,False,False,https://i.redd.it/5gg20u7mjfy41.jpg,https://i.redd.it/5gg20u7mjfy41.jpg
m6egm7230hy41.jpg,relationshipmemes,I'm going to hell for this one,2020-05-13 15:44:32+10:00,False,False,https://i.redd.it/m6egm7230hy41.jpg,https://i.redd.it/m6egm7230hy41.jpg
ljvqrb6sgiy41.mp4,aww,Study Buddy,2020-05-13 20:40:11+10:00,True,True,https://v.redd.it/ljvqrb6sgiy41,https://vreddit.cc/ljvqrb6sgiy41.mp4
nluriogh9iy41.mp4,aww,A dog also needs its own toy and this is what it feels like to make this toy.,2020-05-13 20:00:14+10:00,False,True,https://v.redd.it/nluriogh9iy41,https://vreddit.cc/nluriogh9iy41.mp4
khcpwm2tviy41.mp4,aww,I found my buns ear control mechanism,2020-05-13 22:05:37+10:00,False,True,https://v.redd.it/khcpwm2tviy41,https://vreddit.cc/khcpwm2tviy41.mp4
87dskk27wgy41.mp4,aww,Bathing is the best part of my day 🦔,2020-05-13 15:32:52+10:00,True,True,https://v.redd.it/87dskk27wgy41,https://vreddit.cc/87dskk27wgy41.mp4
lv0vu33aqgy41.mp4,aww,Dog refuses to get out of bed then proceeds to fall asleep looking after baby,2020-05-13 14:52:33+10:00,True,True,https://v.redd.it/lv0vu33aqgy41,https://vreddit.cc/lv0vu33aqgy41.mp4
68pq7mcgihy41.jpg,relationshipmemes,I love her more than 3000,2020-05-13 17:27:31+10:00,False,False,https://i.redd.it/68pq7mcgihy41.jpg,https://i.redd.it/68pq7mcgihy41.jpg
w8zzzk7zpiy41.jpg,earthporn,"Yellow Springs, Ohio. [OC] [1367 X 2048]",2020-05-13 21:31:38+10:00,False,False,https://i.redd.it/w8zzzk7zpiy41.jpg,https://i.redd.it/w8zzzk7zpiy41.jpg
o56cx5ea8iy41.jpg,earthporn,"Bow Summit and Peyto Lake, Canada [OC] [4016x3008]",2020-05-13 19:53:34+10:00,False,False,https://i.redd.it/o56cx5ea8iy41.jpg,https://i.redd.it/o56cx5ea8iy41.jpg
gbgeh7kmriy41.jpg,earthporn,"The rock. Near Mt.Titlis, Switzerland [OC] 3264x4651",2020-05-13 21:41:08+10:00,False,False,https://i.redd.it/gbgeh7kmriy41.jpg,https://i.redd.it/gbgeh7kmriy41.jpg
cx3hc0i13ly41.jpg,aww,Let me go huumaaan! I am the darkness!,2020-05-14 05:29:36+10:00,False,False,https://i.redd.it/cx3hc0i13ly41.jpg,https://i.redd.it/cx3hc0i13ly41.jpg
4gpbzk3tply41.jpg,aww,Adopted This Little Floof Over the Weekend. We Hope She Likes Her New Home!,2020-05-14 07:35:51+10:00,False,False,https://i.redd.it/4gpbzk3tply41.jpg,https://i.redd.it/4gpbzk3tply41.jpg
4thyhnhpnly41.mp4,aww,Finally figured out how my tortoise was getting into the house all by himself!,2020-05-14 07:25:40+10:00,False,True,https://v.redd.it/4thyhnhpnly41,https://vreddit.cc/4thyhnhpnly41.mp4
BowedAdolescentIndigobunting.mp4,aww,This is true love,2020-05-14 05:43:02+10:00,False,True,https://gfycat.com/bowedadolescentindigobunting,https://giant.gfycat.com/BowedAdolescentIndigobunting.mp4
gS6wBUx.jpg,aww,We meowed at him and this was his reaction.,2020-05-14 04:05:08+10:00,False,False,https://i.imgur.com/gS6wBUx.jpg,https://i.imgur.com/gS6wBUx.jpg
8hetzz801my41.jpg,relationshipmemes,Same,2020-05-14 08:38:39+10:00,False,False,https://i.redd.it/8hetzz801my41.jpg,https://i.redd.it/8hetzz801my41.jpg
g91zg7s2yly41.jpg,relationshipmemes,i spend way too much time making him memes,2020-05-14 08:22:12+10:00,False,False,https://i.redd.it/g91zg7s2yly41.jpg,https://i.redd.it/g91zg7s2yly41.jpg
1ew14lfeuiy41.jpg,relationshipmemes,She's so great man 🥰,2020-05-13 21:56:15+10:00,False,False,https://i.redd.it/1ew14lfeuiy41.jpg,https://i.redd.it/1ew14lfeuiy41.jpg
kxvdwbo4qiy41.jpg,relationshipmemes,LET US IN!!!,2020-05-14 00:22:55+10:00,False,False,https://i.redd.it/kxvdwbo4qiy41.jpg,https://i.redd.it/kxvdwbo4qiy41.jpg
kqe7pwcn9ly41.jpg,earthporn,(N)iceland [OC][1080x1350] Insta: @holysh0t,2020-05-14 06:05:17+10:00,False,False,https://i.redd.it/kqe7pwcn9ly41.jpg,https://i.redd.it/kqe7pwcn9ly41.jpg
f3ytqlm6iky41.jpg,earthporn,"American Fork Canyon, UT, USA [OC] 5184x3456",2020-05-14 03:31:22+10:00,False,False,https://i.redd.it/f3ytqlm6iky41.jpg,https://i.redd.it/f3ytqlm6iky41.jpg
soj0pnpywly41.jpg,earthporn,"Black Diamond, WA State, USA [OC 4000x6000]",2020-05-14 08:15:58+10:00,False,False,https://i.redd.it/soj0pnpywly41.jpg,https://i.redd.it/soj0pnpywly41.jpg
x91hpr7ucly41.jpg,earthporn,Fjords in Austria [OC][1080x1350] IG: @bavarianexplorer,2020-05-14 06:23:14+10:00,False,False,https://i.redd.it/x91hpr7ucly41.jpg,https://i.redd.it/x91hpr7ucly41.jpg
b597fqwkkgl41.mp4,aww,He asked a blind classmate to prom with chocolates layed out in braille,2020-05-14 17:03:20+10:00,True,True,https://v.redd.it/b597fqwkkgl41,https://vreddit.cc/b597fqwkkgl41.mp4
j56baxy7any41.jpg,aww,"I'm a 35 Year old male and have wanted a Husky since I was 10. World, say hello to ""Winks""",2020-05-14 12:52:03+10:00,False,False,https://i.redd.it/j56baxy7any41.jpg,https://i.redd.it/j56baxy7any41.jpg
efmyfh2czoy41.jpg,aww,Foxes have the cutest smiles!,2020-05-14 18:35:48+10:00,False,False,https://i.redd.it/efmyfh2czoy41.jpg,https://i.redd.it/efmyfh2czoy41.jpg
egchji7z9my41.jpg,aww,Best picture I could ever hope to get of these two....,2020-05-14 09:30:41+10:00,False,False,https://i.redd.it/egchji7z9my41.jpg,https://i.redd.it/egchji7z9my41.jpg
gg6kzvj.mp4,aww,"Get a kitten, they said. It'll be fun, they said.",2020-05-14 19:49:21+10:00,False,True,https://i.imgur.com/gg6kzvj.gifv,https://i.imgur.com/gg6kzvj.mp4
6nq3r0oc7py41.jpg,relationshipmemes,I'm just very needy,2020-05-14 19:19:32+10:00,False,False,https://i.redd.it/6nq3r0oc7py41.jpg,https://i.redd.it/6nq3r0oc7py41.jpg
1hfc89tnjmy41.jpg,relationshipmemes,This is definitely a want and a need,2020-05-14 10:23:11+10:00,False,False,https://i.redd.it/1hfc89tnjmy41.jpg,https://i.redd.it/1hfc89tnjmy41.jpg
zt00tiq2toy41.jpg,earthporn,Natural framing in Torres del Paine National Park [1366x2048] [OC] insta: @marcograssiphotography,2020-05-14 18:00:31+10:00,False,False,https://i.redd.it/zt00tiq2toy41.jpg,https://i.redd.it/zt00tiq2toy41.jpg
3m0r54mc7my41.jpg,earthporn,In an Oregon forest. [OC] [1920x1080],2020-05-14 09:14:13+10:00,False,False,https://i.redd.it/3m0r54mc7my41.jpg,https://i.redd.it/3m0r54mc7my41.jpg
56ajd4ehfmy41.jpg,earthporn,"Rimrock, AZ [3456x4608] [OC]",2020-05-14 09:59:47+10:00,False,False,https://i.redd.it/56ajd4ehfmy41.jpg,https://i.redd.it/56ajd4ehfmy41.jpg
015wjvy3ksy41.mp4,aww,Daddy’s Home!,2020-05-15 06:36:32+10:00,False,True,https://v.redd.it/015wjvy3ksy41,https://vreddit.cc/015wjvy3ksy41.mp4
tykujpsigry41.jpg,aww,17-½ year old (then) Canadian Black Wolf. Absolutely adorable sweetheart. Her name is Madadh.,2020-05-15 02:54:29+10:00,False,False,https://i.redd.it/tykujpsigry41.jpg,https://i.redd.it/tykujpsigry41.jpg
u86pjvfzlry41.jpg,aww,My cats formed a smiley face today,2020-05-15 03:25:07+10:00,False,False,https://i.redd.it/u86pjvfzlry41.jpg,https://i.redd.it/u86pjvfzlry41.jpg
jzxy70a61sy41.jpg,aww,A family portrait,2020-05-15 04:50:15+10:00,False,False,https://i.redd.it/jzxy70a61sy41.jpg,https://i.redd.it/jzxy70a61sy41.jpg
zgmcq61w9sy41.jpg,aww,Handsome boy,2020-05-15 05:39:12+10:00,False,False,https://i.redd.it/zgmcq61w9sy41.jpg,https://i.redd.it/zgmcq61w9sy41.jpg
x2k229bjnqy41.jpg,relationshipmemes,for my boyfriend since i finally get to see him on saturday,2020-05-15 00:12:02+10:00,False,False,https://i.redd.it/x2k229bjnqy41.jpg,https://i.redd.it/x2k229bjnqy41.jpg
